{
  "title": "A2A Specification Compliance: Audit and Plans",
  "description": "Audit of the Daisy harness's conformance to the A2A (Agent2Agent) protocol, and the design plans for the bidirectional external-agent, OpenTelemetry, and durable input-required work built from it.",
  "repository": "ghovax/daisy",
  "branch": "claude/a2a-spec-compliance-audit-h19bai",
  "pullRequest": "https://github.com/ghovax/daisy/pull/5",
  "commit": "78cd7e930474ec074031ebc6a2a5bacba6a7f2b0",
  "subject": {
    "protocol": "A2A (Agent2Agent)",
    "protocolVersion": "0.3.0",
    "sdk": "a2a-sdk==0.3.7"
  },
  "documents": [
    {
      "path": "audit.md",
      "title": "A2A Specification Compliance Audit: Daisy Harness",
      "kind": "audit",
      "created": "2026-07-16T13:26:44Z",
      "updated": "2026-07-16T13:26:44Z"
    },
    {
      "path": "plans/external-agents.md",
      "title": "Connecting Daisy to External A2A Agents",
      "kind": "plan",
      "created": "2026-07-17T17:44:00Z",
      "updated": "2026-07-18T11:59:20Z"
    },
    {
      "path": "plans/telemetry.md",
      "title": "User-Capturable Telemetry via OpenTelemetry",
      "kind": "plan",
      "created": "2026-07-17T17:44:00Z",
      "updated": "2026-07-17T21:17:26Z"
    },
    {
      "path": "plans/input-required.md",
      "title": "Durable, Segment-Based input-required",
      "kind": "plan",
      "created": "2026-07-18T11:59:20Z",
      "updated": "2026-07-18T12:52:30Z"
    },
    {
      "path": "plans/sub-agent-permissions.md",
      "title": "Sub-Agent Permissions and Propagated Human-in-the-Loop",
      "kind": "plan",
      "created": "2026-07-18T14:27:02Z",
      "updated": "2026-07-18T14:53:41Z"
    }
  ],
  "generatedAt": "2026-07-18T14:27:02Z"
}
